{"artifacts":[],"blind_reference_mode":true,"case_id":"contract-fixture","created_at":"2026-09-08T00:00:00Z","gates":[],"interaction_mode":"autopilot","reference_access":[],"retry_history":[],"revision":0,"rigor_profile":"lean","schema_version":"2.0","updated_at":"2026-09-08T00:00:00Z","workspace_kind":"fixture"}
